{
  "activeTfvars": {
    "application_release": {
      "authentication": {
        "active_revision": "agora-authentication-rest-05dd27719270",
        "images": {
          "init": "europe-west1-docker.pkg.dev/agora-production-test/agora-production/service-authentication/jobs/init@sha256:ffffffffffffffffffffffffffffffffffffffffffffffffffffffffffffffff",
          "migrations": "europe-west1-docker.pkg.dev/agora-production-test/agora-production/service-authentication/jobs/migrations@sha256:1111111111111111111111111111111111111111111111111111111111111111",
          "rest": "europe-west1-docker.pkg.dev/agora-production-test/agora-production/service-authentication/rest@sha256:2222222222222222222222222222222222222222222222222222222222222222"
        },
        "revision": "agora-authentication-rest-05dd27719270",
        "secrets": {
          "postgres_password_version": 1,
          "smtp_password_version": 3,
          "super_admin_password_version": 4
        },
        "smtp": {
          "address": "smtp.example.com:587",
          "sender_domain": "smtp.example.com",
          "sender_email": "noreply@example.com",
          "sender_name": "Agora",
          "username": "smtp-login@example.com"
        },
        "super_admin_email": "admin@example.com",
        "web_client_url": "https://www.example.com"
      },
      "json_keys": {
        "active_revision": "agora-json-keys-grpc-b745f42472f7",
        "images": {
          "grpc": "europe-west1-docker.pkg.dev/agora-production-test/agora-production/service-json-keys/grpc@sha256:bbbbbbbbbbbbbbbbbbbbbbbbbbbbbbbbbbbbbbbbbbbbbbbbbbbbbbbbbbbbbbbb",
          "migrations": "europe-west1-docker.pkg.dev/agora-production-test/agora-production/service-json-keys/jobs/migrations@sha256:cccccccccccccccccccccccccccccccccccccccccccccccccccccccccccccccc",
          "rotate_keys": "europe-west1-docker.pkg.dev/agora-production-test/agora-production/service-json-keys/jobs/rotatekeys@sha256:dddddddddddddddddddddddddddddddddddddddddddddddddddddddddddddddd"
        },
        "revision": "agora-json-keys-grpc-b745f42472f7",
        "secrets": {
          "app_master_key_version": 7,
          "postgres_password_version": 5
        }
      },
      "rollout": {
        "candidate_tag": "c-f6fb5343c792a0e5",
        "phase": "active",
        "services": ["json_keys", "authentication"]
      }
    },
    "backup_bucket_name": "agora-management-test-123456789012-backups",
    "cloud_run_invocation_tags": {
      "key": "tagKeys/100000000001",
      "values": {
        "initializer": "tagValues/200000000001",
        "internal": "tagValues/200000000002",
        "recovery": "tagValues/200000000003",
        "release": "tagValues/200000000004",
        "scheduled": "tagValues/200000000005"
      }
    },
    "database_hosts": {
      "authentication": {
        "data_disk_id": "1001",
        "private_ip": "10.20.0.2"
      },
      "json_keys": {
        "data_disk_id": "1002",
        "private_ip": "10.20.0.3"
      }
    },
    "database_releases": {
      "authentication": {
        "backup_password_version": 2,
        "image": "europe-west1-docker.pkg.dev/agora-production-test/agora-production/service-authentication/database@sha256:eeeeeeeeeeeeeeeeeeeeeeeeeeeeeeeeeeeeeeeeeeeeeeeeeeeeeeeeeeeeeeee"
      },
      "json_keys": {
        "backup_password_version": 6,
        "image": "europe-west1-docker.pkg.dev/agora-production-test/agora-production/service-json-keys/database@sha256:aaaaaaaaaaaaaaaaaaaaaaaaaaaaaaaaaaaaaaaaaaaaaaaaaaaaaaaaaaaaaaaa"
      }
    },
    "management_project_id": "agora-management-test",
    "network_id": "projects/agora-production-test/global/networks/agora-production",
    "region": "europe-west1",
    "runtime_service_accounts": {
      "authentication": "agora-authentication@agora-production-test.iam.gserviceaccount.com",
      "backup": "agora-backup@agora-production-test.iam.gserviceaccount.com",
      "json_keys": "agora-json-keys@agora-production-test.iam.gserviceaccount.com",
      "restore": "agora-restore@agora-production-test.iam.gserviceaccount.com",
      "scheduler_invoker": "agora-scheduler-invoker@agora-production-test.iam.gserviceaccount.com"
    },
    "subnet_id": "projects/agora-production-test/regions/europe-west1/subnetworks/agora-production-europe-west1",
    "workload_project_id": "agora-production-test"
  },
  "createdAt": "2026-09-17T12:00:00Z",
  "database": {
    "authenticationBackupPasswordVersion": 2,
    "authenticationImage": "europe-west1-docker.pkg.dev/agora-production-test/agora-production/service-authentication/database@sha256:eeeeeeeeeeeeeeeeeeeeeeeeeeeeeeeeeeeeeeeeeeeeeeeeeeeeeeeeeeeeeeee",
    "authenticationPasswordVersion": 1,
    "hosts": {
      "authentication": {
        "dataDiskId": "1001",
        "privateIp": "10.20.0.2",
        "releaseRevision": "aaaaaaaaaaaaaaaaaaaaaaaaaaaaaaaaaaaaaaaa"
      },
      "json_keys": {
        "dataDiskId": "1002",
        "privateIp": "10.20.0.3",
        "releaseRevision": "aaaaaaaaaaaaaaaaaaaaaaaaaaaaaaaaaaaaaaaa"
      }
    },
    "jsonKeysBackupPasswordVersion": 6,
    "jsonKeysImage": "europe-west1-docker.pkg.dev/agora-production-test/agora-production/service-json-keys/database@sha256:aaaaaaaaaaaaaaaaaaaaaaaaaaaaaaaaaaaaaaaaaaaaaaaaaaaaaaaaaaaaaaaa",
    "jsonKeysPasswordVersion": 5,
    "releaseRevision": "aaaaaaaaaaaaaaaaaaaaaaaaaaaaaaaaaaaaaaaa"
  },
  "imageManifest": {
    "components": {
      "service-authentication": {
        "enabled": true,
        "images": {
          "database": {
            "digest": "sha256:eeeeeeeeeeeeeeeeeeeeeeeeeeeeeeeeeeeeeeeeeeeeeeeeeeeeeeeeeeeeeeee",
            "repository": "ghcr.io/a-novel/service-authentication/database",
            "tag": "v1.2.3"
          },
          "jobs/init": {
            "digest": "sha256:ffffffffffffffffffffffffffffffffffffffffffffffffffffffffffffffff",
            "repository": "ghcr.io/a-novel/service-authentication/jobs/init",
            "tag": "v1.2.3"
          },
          "jobs/migrations": {
            "digest": "sha256:1111111111111111111111111111111111111111111111111111111111111111",
            "repository": "ghcr.io/a-novel/service-authentication/jobs/migrations",
            "tag": "v1.2.3"
          },
          "rest": {
            "digest": "sha256:2222222222222222222222222222222222222222222222222222222222222222",
            "repository": "ghcr.io/a-novel/service-authentication/rest",
            "tag": "v1.2.3"
          }
        }
      },
      "service-json-keys": {
        "enabled": true,
        "images": {
          "database": {
            "digest": "sha256:aaaaaaaaaaaaaaaaaaaaaaaaaaaaaaaaaaaaaaaaaaaaaaaaaaaaaaaaaaaaaaaa",
            "repository": "ghcr.io/a-novel/service-json-keys/database",
            "tag": "v2.5.0"
          },
          "grpc": {
            "digest": "sha256:bbbbbbbbbbbbbbbbbbbbbbbbbbbbbbbbbbbbbbbbbbbbbbbbbbbbbbbbbbbbbbbb",
            "repository": "ghcr.io/a-novel/service-json-keys/grpc",
            "tag": "v2.5.0"
          },
          "jobs/migrations": {
            "digest": "sha256:cccccccccccccccccccccccccccccccccccccccccccccccccccccccccccccccc",
            "repository": "ghcr.io/a-novel/service-json-keys/jobs/migrations",
            "tag": "v2.5.0"
          },
          "jobs/rotatekeys": {
            "digest": "sha256:dddddddddddddddddddddddddddddddddddddddddddddddddddddddddddddddd",
            "repository": "ghcr.io/a-novel/service-json-keys/jobs/rotatekeys",
            "tag": "v2.5.0"
          }
        }
      }
    },
    "postgresMajor": 18,
    "schemaVersion": 1
  },
  "kind": "deployment",
  "operations": {
    "executions": {
      "authenticationMigrations": null,
      "jsonKeysMigrations": null,
      "jsonKeysRotation": null,
      "postgresBackupAuthentication": null,
      "postgresBackupJsonKeys": null,
      "postgresBackupMonitor": null,
      "postgresRestoreAuthentication": null,
      "postgresRestoreJsonKeys": null
    },
    "health": {
      "authentication": "passed",
      "jsonKeys": "passed"
    },
    "initialization": null
  },
  "schemaVersion": 1,
  "sequence": {
    "runAttempt": 1,
    "runId": "123"
  },
  "source": {
    "commit": "aaaaaaaaaaaaaaaaaaaaaaaaaaaaaaaaaaaaaaaa",
    "manifestSha256": "9a31984a7eaba31d26a109d7258ec81c43130736396a3a3c2e1fc3880b10bf68"
  }
}
